영화평점,영화감상평
8,스토리를 떠나서 영상만 봐도 충분히 가치있는 영화.솔직히 스토리만 보면 그저 그렇지만 그 스토리가 3편을 위한 초석이라면 이해된다.
3,"복수한다면서 애들 안죽이고 싹다 계속 풀려나는거 속터짐 ㅋㅋ 그리고 대령아들이랑 나비족 가족들 가족처럼 지냈으면서 아들엔 아들 ㅇㅈㄹ하면서 칼로 가슴긋고 사과도 안함 개연성 ㅅㅌㅊ ㅋㅋ 차라리 처음에 나온 테라포밍을 가져와서 전쟁으로 찍으면 내용면이나 전투면에서 스케일이라도 컸을텐데 복수 ㅇㅈㄹ하고 환경지키자 이런개똥 철학으로 영화를 만드니 이게 내용이 짬뽕이 안되고 뭔내용이야 이런 느낌 """"""뭘 강조 하고싶은데?""""""<==이게 끝 ㅋㅋ 판타지영화인지? 판타지 다큐인지?"
9,고래 못살게 구는 것이 딱 왜놈들 같아.
8,영상미는 가히 놀랄 정도로 압도적
10,웅장하다... 우리나라에선 절대 나올수없는 스케일
10,말이 필요없어요. 그냥 보세요. 평점 높이려고 씁니다
9,개인적으로 잘 봤습니다.
10,"3시간이 진짜 너무 금방 갈 정도로 영상미, OST가 너무 아름답고 새로운 캐릭터들의 활약이 스토리 전개를 더욱 돋보이게 한 시리즈! 3,4 편이 너무 기대되요!"
10,아바타2보고 울고 집에가서 아바타1보고 또 울고
10,안보면 손해같아요2편까지 오래 걸렸지만 기다린 보람이 있었음다♡
10,3D로 봤는데 영상미 진짜 장난아니네요ㅎㅎ
10,"와..스토리가 뻔하다는 리뷰보고 그저그런갑다 했는데 스토리,영상 모두 너무 완벽하고 아바타를 볼수있음에 영광이었습니다.제임스카메론 감독은 오래오래 사셨으면.."
7,영화라기 보다 그냥 돈 쳐바른 애니메이션 느낌이 남…
8,지루하다 196분은 너무하네 다음에는 150분이하로 줄이십시오..진심 루즈합니다.
10,이건 극장아니면 감동을 못 느낄듯 진짜 극장을 위한 영화가 오랜만에 나왔네
10,누가 지루하다했나요..!!!시간순삭이에요.꼭 보세요!!
8,3시간 넘는 러닝타임이 전혀 지루하지 않았다. 모든 장면의 CG가 끝내준다.
10,제발 3편 내년에 개봉해주세요24년까지 언제 기다려요
10,와 아바타에 푹 빠졌어 ?? 너무 재밌는데요?
10,누가 지루하고 재미없다고했나.. 어처구니없네..이정도 스케일에 영화를 고작 2만원도 안되는가격에 볼수있다니.. 감독에게 감사할따름..
2,지루해요..1편도 지루했는데 2편은 더 지루하네요..보는데 편두통왔어요..
8,말은 안해도 혈연은 혈연이다
10,"오늘 보고 왔는데, 정말 영상이 너무나 아름다워요. 그리고 툴쿤이라는 가상의 동물로 인해 참 많이 슬펐어요. 고래잡이가 저런 식인가 싶더라고요…"
10,감동적이고 너무 그래픽이 예쁨 ㅠㅠㅠㅠ 영화관에서 보는거 강추
8,자 솔직하게 말할께요!3d는 NO....!^^영화는 전체적으로 GOOOD
4,"제이크 설리 한 명을 잡기 위해 판도라 행성에 군대를 보내고 나비족을 다 OO다는 설정이 너무 개연성이 없고 황당하다. 파견된 지구인 부대 전체를 단순 악으로만 묘사하고, 갈등 구조도 없고 스토리 전개도 빈약하여 감정이입이 될 만한 포인트를 찾을 수가 없다. 차라라 이야기가 산으로 가기라도 하면 산으로 따라가기나 하지, 이건 관객을 끌고 가는 서사라는 요소는 없고 게임하듯 선과 악이 전투하는 것밖에 없다. CG에만 의미를 둔 것처럼 느껴지기까지 하는데, CG가 1편을 능가했다는 느낌을 딱히 받지도 못했다."
10,이건정말레전드!!3시간이 넘는데도 지루한 부분이 하나도 없음 정말로
1,그냥 개연성 없고 쓰레기 같은 3시간이였음.보지마세요 시간아까움
10,향에 중독되고 나옴.. 옷에 배김 ㅋㅋㅋ 조음..
10,재밌었음 초반 한시간은 지루했는데 뒷부분은 굿
7,스토리는 고래사냥 & 타이타닉 마지막 나비 아줌마 아들다이 버프넘 심하다..마을 사람들 싸우다 말고 다 어디간거냐?
10,보다가 움.. 중간 중간 슬픈 부분에서 우리 가족이 보고싶어졌음..ㅠ ㅅㅂ 카메론 사랑해♥?
4,"최대한 보면서 안자려고 노력했는데 잠들어버림,, 나한테는 재미없었음"
10,13년을 기다려온 보람이 있다. 사람이 아닌 외계종족이 전달하는 메시지는 그 어떤 종족에도 해당되지 않는지 생각해보게 된다.
10,"3시간이 넘는 시간동안 판도라행성에 여행을 다녀온 느낌, 이런게 영화가 주는, 영상미가 주는 감동이란걸 느꼈다. 지구와 우리의 자연을 좀 더 아름답게 지켜나가야지 다짐하며 마지막엔 눈물까지 흘렸다."
8,카메론감독의 해양보호 물에 대한관심이 잘들어나있어요 그걸 영상미로 !!
9,시간 가는 줄 모르고 봤습니다.
10,.아바타물의길아바타물의길아바타
10,영상미 최고입니다. 눈이즐겁다
10,인간의 상상력은 한계가 없다!! 박수 쳐주고싶은 영화!! 우리나라 영화에서도 이런영화를 볼수있는날이 곧 오겠지??
10,역대급 영상미
8,영상미는 좋았으나 중후반에 좀 지겨움과 진부한 가족애 스토리.
6,아바타1+타이타닉=아바타2 ㅋㅋ 2세들이 설명도 없이 갑툭튀해서 얼떨떨 하면서 보게됨 살짝이라도 설명이 되었었으면 좋았을듯. 영상미에 비해 스토리는 기억에 남는게 거의 없음.
10,진짜 최고.... 나비족 하고싶다..
10,i luv USA RRRR
10,너무 상상을 토대로 만든 영화라서 너무 실감나게 잘 보았다
9,컴퓨터 그래픽의 정점이란 것 만으로도 볼만한 가치가 있는 영화광학을 이정도로 완벽히 표현할 수있는 영화는 없습니다
9,"이 정도 퀄리티의 영화라면 무조건 3D 이상의 스케일 큰 영화관에서 봐줘야하지 않을까요? 2009년 당시 1편 정도의 센세이션까지는 느낄 수 없었지만 충분히 그만한 가치는 한다고 생각합니당. 앞으로 살면서 이정도 대작을 몇번이나 만날 수 있을까요? 관람 전 맥주, 커피, 음료 자중하세요 ㅋ"
10,이건 무조건 최소 아이맥스로 봐야함. 꼭 부탁할게...진심이야!!
10,대박 장난아님 눈아프지만 대박
8,영상미 때문이라도 꼭 볼 영화 리스트 최상위 링크에 올린만 함 스토리가 그냥그냥 볼만한 정도 중간엔 크게 용트름 할 만큼 지루한 고비도 있었음 하지만 완전 눈과 마음을 사로잡는 놀라운 영상미 다시 보라면 또 볼 의향 있음
10,영화가 인간에게 줄 수 있는 최대치를 보여줌아바타가 되고싶은 1인
10,진짜 ㄹㅇ 미쳤음..이거는 영화관에서만 봐야함…
10,항 ㅠ 너무 재밌다 진심ㅠㅠ
10,감동적이고 너무 재밌어서 3시간동안 한번도 졸지 않고 봤어요!!
10,걍 3글자로 표현가능 미쳤따..!!
9,최고의 영상미 하지만 약간 아쉬운 스토리
10,ㄹㅇ나비족 섭외한줄ㄷㄷ
10,그 어떤 말로 표현을 할까요... 감동을 넘어 경이로움과 아름다움 아아 그 어떤 말로 형언 할 수가 없었던 아바타2... 가슴에 큰 울림과 감동은 정말 지상 최고인듯합니다!!!! 집와서 다시 1편을 시청중이네요! 가족 영화도 강추입니다~!!! 정말 환상적인 장면장면!!! 감동입니다!!!
8,가슴이 찡한 스토리가 없는 것이 아쉽네요
10,조쿠나 조아!! 여름에 개봉했음 징짜 더 좋았을듯!! 진심 여름에 함더 극장서 보구싶다!!
10,설리 가족은 하나다 크~
10,실망이 없는 아바타 굿굿
10,분명히 좀 지루하다하면서 봤는데 왜 또한번 더 보고싶단 생각이 드는거지?.. 거참 신기하네~
10,너무 재밌고 힐링이 돼는 영화였습니다. 너무 재밌고 감동적이예요.
9,역시 실망시키지 않는 영화였습니다. 고퀄리티에다 매우 경이롭다는 느낌까지 전해졌습니다. 이건 꼭 4DX로 봐야합니다. 하지만 물 장면이 많은데 물은 한 방울도 안나오고 바람만 약하게 휙휙 불어서 9점 줍니다.
10,인생 최대 명작입니다 꼭 보세요
4,평점 너무 후한거 아닌가요?영상미는 좋은데 개연성 너무떨어짐..판도라행성 나비족들이야 원쥔이니까 지능이 좀 떨어진다고 해도 주인공은 원래 사람에 군인도 상병씩이나 달정도면 최소 몇년은 군대에서 굴럿다는건데..판도라행성에 살면 지능이 떨어지는건지..산호초부족도 골때리긴 마찬가지고..영상미감상하러 보세요내용엔 개연성 찾진 마시구여..개인적으론 고구마 백만개
10,영상미는 끝내준다. 세상 만사 집어치우고 판도라 행성 가서 나비족으로 살고 싶다.
10,영화관이 망하지 않은이유 1가지:
2,주제의식을알수없다.
10,"저는 개인적으로 아바타 1보다 이번 2가 더 재밌었습니다. 영상미가 너무 좋았고, 스토리도 괜찮던데요~"
10,미쳤다 중간부분은 개인 지루 or 흥미 호불호 반반일듯
10,나도 아바타로 태어나서 아바타랑 결혼 하거 싶다..늠 므쪄..♥
9,재밌게 잘 봤어요~ 다음 시리즈도 빨리 보고 싶어요
10,안보면 후회함 진심으로ㅠ
7,볼만함
9,영상미의 극대화 !!
10,"진짜 지리긴하네 스토리는 대단한 이야기 아니지만 ""엄청나게 많은 돈으로 엄청나게 때려박은 CG로 뭐든 가능하구나""를 알려주는 손익분기점 2조6천억짜리 영화 꼭 3D로 보는거 추천 무슨 영화가 아니라 어트랙션 탄 기분이었음 볼 가치가 충분함"
10,이보다 더 잘만들기 어려울듯. 훌륭했다.
10,나비족은 실존인가!?
10,너무 재미있게 봤네요!!3D로 봤는데 곧 2D로 한번 다시볼 계획입니다 .ㅋㅋ
10,스토리는 진부하고 미흡하지만영상미와 ost가 다한 영화
10,영상미 보는 재미로 힐링하며 봤어요
10,하 그냥 슬프고 재밌고 대박이에요 그냥 설명할수없어ㅠㅠ 한번 보세요 젭알
10,영상미 하나로 10점 쌉가능
10,진짜 소문대로 볼거리많고 영상미가 화려합니다. 재밌기도하구요.다만 3시간내내 3D로 보는건 역시 힘들기도하고 영화 속 인간을 너무 뻔한 스토리의 인성쓰레기로만 만든것도 아쉽습니다.
10,이 영화를 10점 안준 사람은 도대체 어떤 영화를 본거냐?
10,다 필요 없고 내 인생영화 바뀜
10,영화 보러 왔더니 판도라 여행 시켜준다는 말이 사실
8,세시간의 황홀경을 머금은 이방인들의 서사.
9,13년이란 기다림은 아깝지 않다는 걸 CG로 증명한 카메론 옹...
10,왠만해선 1을 뛰어넘긴 쉽지않은데…와우…
9,명불허전보는 내내 영상미가 대단하다는생각밖에..보기전에 3시간 10분이라는 러닝타임이 부담스러웠지만 막상 보니 그렇지도 않았음
6,딱말합니다 아바타1이 더재밋습니다
1,"아동용 그래픽 포르노 제일 강점으로 내세운 1시간 반만 보면 같은 그래픽 반복. 진짜같은 cg는 맞지만 비현실 적인 배경이 많았던 전작과 달리 해변, 바다를 중심으로 한 장면이 대부분이라 특별한 감상 없이 와, 진짜 같다는 생각만 듦. 그냥 휴양지 해변 모습을 3시간 동안 보고 온 기분. 스토리, 액션은 역시 최악. 나비족 특성상 안면 주름이 적어서 연기도 어떤 감정을 표현하려는 건지만 알 정도. 스토리 진행도 무슨 어린애들 애니메이션보다 못한 기억. 동족 폭행, 주거지 연쇄 방화는 가족을 지키기 위해 참고 가족 납치는 온 병력 다끌고 가는 주인공. 동족을 가족 지키는 도구로 철저히 대한다고 느껴진 장연. 인질을 잡고 제대로 써먹지 못하는 적들. 그래도 끝까지 인질에 집착하는 이유 모름. 기타 아무런 매력을 느낄 수 없는 최악의 영화."
10,나 진짜 펑펑 울었다 재밌으니까 꼭 보길
10,8점대는 아닌거 같다. 뭐하나 흠잡을거 없이 영상미 하나만으로도 영화비는 뽑고도 남으며 작품볼 3시간을 못견딤은 본인자신에게 평점을 먹여야 한다.
10,아이맥스 3d
10,"너무 너무 잘봤어요. 3d로 한번 보고 2d로도 한번 봤어요. 각각 다른 매력이 있지ㅏㄴ, 역시 3d로 보는거 추천해요."
10,"몰입 미쳐가지고 끝나고 나서 내 옆에 툴쿤 있을거같음,,, 진짜 보면 앎"
8,"솔직히 스토리는 무난하다 싶지만, 영상/연출 등 완벽하다라는 말을 써도 될정도.. 꼭 IMAX 3D로 보는게 좋을것 같고, 기존 3D에 거부감 있는 분들에게 거부감 바로 날려줄 영화.."
10,인간의 아이디어로 감히상상할수없는 스케일돌고래와 나비족의자연친화적 애정?가족이 요새다란 명언처럼 애정으로뭉친 가족의무궁한희생 ~~감동대박
10,세상에 아바타안본사람 없게해주세요…
10,또 보러가고싶다ㅜㅠ!! 시즌1 나왔을대가 9살이었는데 22살되고보니 너무 새롭고 시즌1 보고 갈걸~ 했는데(안보고 봐도 이해는됩니다!) 지금 시즌1 챙겨봐야겠어요 엄마랑 봤는데 시즌 1 다음 2가 13년만에 나왔다고...시즌 3 4 나온다고 하시던데 엄마가 80세까지는 사셔야겠네 라는 대화를 했는데 너무 웃겨서...ㅋㅋㅋ 추천해요!! 개봉한지 13일이 지나서 왠만하면 주위이서 다 봤더라구요 같이 볼사람만 있드면 또 볼거에요!!
10,제임스 카메론 감독은 원래 나비족임이 틀림없다
7,3시간이 넘지만 눈을 뗄수 없는 압도적인 기술의 혁명에 물속 여행을 마음껏 만끽하며 호강한 기분
6,카메론 감독님! CG영상 만드느라 고생 하신건 충분히 알겠는데...
10,올해 최고의 감동적인 영화였습니다.
10,진짜 인생에 한 번 볼까말까한 영화다. 아바타1을 극장에서 못봐서 아쉬운데 그 아쉬움을 덮었다
10,눈도 너무 즐겁고 경이로웠습니다. 스토리도 너무 감동적이었어요...
1,지루하고 재미없어요 그리고 2조를 투자할만큼은 아닌듯ㅋ
10,너무 인상 깊게 봤어요.
8,아바타1 잘봤었고 이번에 3D로 봤는데 한 번 볼만 한 영화라는 생각입니다. 솔직히 영화관이 아니라면 중간에 지루해서 탈주할 수 있는데.. 영화관에서 3D로 보니까 감상하면서 볼 수 있었어요. 특히 물이 나오면서는 재밌었습니다!
9,특히 영상미가 너무훌륭했어요~힐링을 하고온듯한 영화였습니다~
10,내가 본 영화 중 가장 명작임
10,완전…베리..나이스…영화
9,어느 한 분야의 정점을 찍은 자의 '결과물의 길'을 따라가는 것만으로도.
10,아바타3 빨리 나왔으면
2,"아니 물의족장은 싸우다 말고 어디로 가버린것인가?너무 후속편만 생각하면서 영화를 만든거 아닌가요,,,"
2,솔직히 모르겠음.내용이 영상미 만큼 좋다할수있는지...
7,영상미가 볼만하고 스토리도 무난한데 3시간까지 늘어질 영화는 아닌 것 같습니다
8,"장단점이 확실한 영화장점은 단연 영상미와 연출이라 할 수 있겠고, 단점은 뻔한 스토리와 부족한 개연성. 스토리만을 중시한다면 평범한 스토리에 실망할 수 있는 작품이나, 영상미 또한 중요시 한다면 영상미만으로도 또 보고 싶어지는 영화"
10,그저 쩐다. 개쩐다 이말밖에 안나온다.
10,즐겁게 봤습니다. 역시 최고
10,2년 또 어떻게 기다리죠 ㅜㅜ진짜 영상 연출 감탄만으로도 3시간 반이 훌쩍 가는 느낌 스토리가 아쉽다는 평도 이해는 되는데 시사하고자 하는 바가 확실하게 느껴져서 좋았어요
6,아바타1 당시 cg수준때 아바타를 보니까웅장하고 엄청났는데지금의 기술력으로 아바타2 아이맥스로보니1편때 처럼의 그런 느낌은 전혀 없었음..그냥 그런 스토리와 이젠 익숙해져버린 cg가 전부..너무 기대하지는 말길..
10,진짜 재밌어요!!!!
8,5부작의 시작!!큰 그림을 바라보며 단점을 이해하고 극복하길 기대해본다
10,"3시간 진짜 안 아까워요~~~ㅠㅠ오늘도 봤습니다^^3번째 봅니다^^제이크 설리 연기도 진짜 잘해~ㅠㅠ 보는 내내 제이크 설리만~~^^ 솔직히 진짜 멋지다ㅠㅠ~~~오늘부터 제이크 설리 팬~~^^수중배경 진짜 예뻤음~ㅠㅠ네이티리(조샐다나)가 부르는 노래하고,영화 끝날 때 나오는 영어 노래ㅠㅠ진짜ㅠㅠ~~^^"
9,멧카이나족이 되고 싶었음. 둥둥 바닷 속은 엄청 환상적임. 스토리도 나쁘지 않았다고 생각함. 세시간 초반을 잘 버텨서 용궁 세계를 같이 탐험해보길 바람
10,재미있게 봤어요 굿잡굿잡
10,시즌1만큼 재미있었다.
6,서사는 너무 평범했어요. 만약 3D 보지 않았더라면 매우 지루했을듯....
2,"나오는 장비들은 오오~~ 하면서 감탄을 나오게 했다. 그러나 뻔한 스토리와 중국인의 등장, 별 내용없는 요소들로 3시간을 버렸고 인류의 배신자였던 제이크는 또다시 자신의 부족을 버리고 가족을 선택한다는 모습을 보여주면서 다른 부족의 희생을 요구했다."
10,2조원이 넘는 제작비를 영상미와 음악에 올인한 영화.스토리가 유치해도 영상미와 음악이 모든 단점을 커버함.
10,"오래 걸린 이유가 있네요 영상미, cg 진짜 최고라고 할수 있습니다!! 2g로 봤는데도 제가 물속으로 들어가는느낌이었어요:) 아바타2는 1처럼 사이다가 많지는 않지만 3을 위한 그런 느낌스,,, 그래도 너무 좋았습니다 가족에 대한 사랑,, 교훈이 있어요 아바타 사랑해요"
9,"지인의 추천으로 아이맥스로 봤습니다. 지방이라서 스크린이 작아서 아쉬웠지만, 아이맥스 강추합니다, 쵝오. 3시간이 3쿼터로 나눠집니다.스토리는 헐리웃 대표적인 영화이며, 3편이 기대됩니다.다만 마스크와 안경을 착용하여 혈압환자들은 계속 앉아있어야 하므로 조심하셔야합니다."
10,별 기대 안하고 보니 더 재밌게 봤어요너무 재밌게 봐서 한번더 볼거에요!
10,너무 재밋엇어요ㅠㅠㅠ영상미가 미쳣음그 스토리는 사실 약간 뻔한 클리셰인데 영상미가 그걸 다 이겨버림… 3시간 내내 지루하지않고 잘봣음…. 바다 표현이 미쳤움ㅋㅋ 휴양지간거같 힐링됫음..
10,3시간 쉴틈없이 넋놓고 보았다
10,아무 정보 없이 봤는데 엄청 신나네요 ㅋㅋ 놀이기구 타는 줄
10,기대 이상으로 좋았지만 러닝타임이 너무 김
10,진짜 인간 싫어지게 만드는 영화 !!! 인간들이제일 문제다 !! 많은 교훈을 주고 자식을 사랑하는 마음은 인간 동물 나비족 다 똑같다 !!! 다 소중해 !! 동물을 아낄줄 알고 생명을 아낄줄 알아야 함을 자식들에게 가르치게 하는 영화 영상미 말해 뭐해 ... 다들 꼭 보시길 !!!
10,최고라는 말 밖에...
10,내가 이걸 3시간이나봄? 개 재밌게봄 시간 가는줄 모름
10,미친 cg 나비족의 눈물 다큐멘터리보는 줄.
10,ㅠㅠㅠ존잼이에요!CG도 CG지만 진짜 보는 내내 너무 예쁘고 너무 갬동적
10,최고였어요 3편이 너무 기대됩니다
10,터미네이터(기계와의 전쟁)+에어리언2(외계인과 인간의 싸움-상황은 정반대지만)어비스(바닷속)+타이타닉(배침몰)+아바타1까지 제임스카메론이 걸어온 경험이 이안에 다 담겨져 있는거 같다.거기다+해양 다큐멘터리.왜 13년이 걸렸는지 알거같은 영상미는 꽤 훌륭하지만 전편에비해 긴장감없는 스토리는 아쉬운편...그래도 아맥 22000원의 값어치는 한다
10,명불허전 최고 ??
2,스토리 뻔하고 진부함..아이맥스에서 봤다면 재밌으려나..암튼 꽤 지루.
10,3d 로 한번 보고 2d로 한번 더 봤어요. 역시 아바타는 3d 이상으로 보는게 맞는 것 같아요. 또 보라고 하면 또 볼 수 있을 것 같아요.
10,3시간이 금방 흘러감. 1편 보다는 재미 없었음. 그러나 볼만함. 액션이 조금 약한 듯. 다음 편도 기대됨.
10,대~~~~박이런게 영화지!
6,개인적으로는 그냥 CG 능력이 뛰어나다고 할만한 영화이지 3시간을 앉아서 볼만한 대작은 아닌 것 같아요그냥 공상 과학 영화 수준~
10,진짜 존나 존나 존나 슬픔
10,판도라까지 직접 가서 촬영하느라 13년 걸렸나?
8,스토리는 유치했으나 영상미가 끝내줬다
10,영상미가 돋보이는 감동적인 영화
10,"그냥 개쩔음, 나는 아바타1보고 개쩐다라고 생각했는데, 아바타라는 진짜 미친거임, 난 2번볼거임"
10,보는 내내 감탄만 나오는 영화
10,오로지 영상미 하나로 10점...아쿠아리움보는거같았어요
9,"가족애, 성장, 자연과의 공존에 대한 이야기들이 지금까지 너무 많이 소모되어왔던 주제이기에 누군가에게는 스토리가 진부하다고 느낄 수도 있겠다 생각됩니다. 그래도 그 이야기를 풀어가는 과정이 정성스럽다는 생각이 들었으며, 영화속에 들어있는 세세한 디테일들을 찾아보는 재미가 있었습니다."
6,영상미를 중요시하거나 아바타1을 재밌게보셨으면 이것도 재밌게 보실거같아요
6,연출좋음내용없음.
10,판도라에서 촬영한 나비족 다큐. 스토리 진행이 느린 편이지만 영상미가 압도함. cg가 어설펐으면 지루했을수도
2,"아바타 1과 너무 판박이. 이렇게 지겨운적이. 마지막 1시간은 액션이 난무해도 잤다는. 기생충보고 까무라치게 놀란 이후에, 이런 눈뽕 액션은 이제 지겹다."
10,"아바타2가 나오는데 오래걸린 이유를 알겠다. 1은 CG로 가능했지만 2는 직접 판도라에 갔다온거였다. 줄줄이 개봉할 3 4 5도 기대된다. '재미없다 지루하다'라고 하는데, 이 부분은 1편에서 이미 주연 캐릭터들의 성격을 파악하고 있기 때문에 특정 상황에서 주연 캐릭터가 어떻게 행동할지 예측이 가능하다는 부분에서 그렇게 느낄 수도 있을 것 같다. 하지만 그렇다고 하더라도 주인공 가족의 스토리라던가, 업그레이드된 CG는 지루하다는 느낌을 주지 않았다. 3D 아이맥스로 봤고 만족 100"
9,잘만든 영화네요 재밌게 봣씁니다
10,영상미가 끝내줘요~
10,용산 아이맥스에서 봤는데 나비족이된듯한 느낌이었어요
9,화면이 너무 아름다웠다
1,별하나도 아깝습니다. 너무 지루하고 스토리도 별로 여서 돈이 아깝더라고요
10,기대이상으로 재미있었다. 특히 CG부분은 이세상 영화중 최고라고 생각한다. 아쿠아리움에 들어와 있는 착각이 느껴질 정도....
10,영상만큼은 와… 하는 탄성이 저절로 여러번 나오데요. 애들이 친구들이랑 먼저 보고 적극 권유해서 극장갔는데 가길 잘한거 같아요
8,3d로 세시간.. 두통이 좀 생기지만 영상미가 훌륭하고 볼거리가 많아요
8,고래 불쌍해 물개같은애도 불쌍해 나비족 불쌍해 인간이 제알나빠 타노스가 옳았다
10,"ㄹㅇ 꼭 흥행 2위해서 본전 이상으로 뽑고 4,5편까지 나왔으면 좋겠당"
10,스토리는 그냥 없다 생각하고 봐도 영상이 워낙 압도적입니다. 기술이 놀라울정도. 스토리는 진심 이렇게 밖에 못하나 싶었음. 지구가 죽어가서 개척하러 왔다더니 왜 제이크만 따라다녀;;
10,"솔직히 처음에는 재밌는지 잘 모르겠었는데…가면 갈수록 아바타 캐릭터들과 판도라 행성, 그리고 새로운 부족에 매력을 느껴버렸다… 엄청난 스케일의 화려함…3시간이 금방 순삭되는 듯 싶었다."
6,아바타1의 감동을 기대하고 비싼돈주고 3D로 봤는데 그냥저냥 그럼..
10,정말 신비롭고 아름답습니다
8,멋진 영상미가 좋았습니다
6,3D도 봤는데 멀미나서 너무 괴로웠음 ㅠ 영화보고 이틀동안 고생..멀미탓도 있겠지만.. 루즈했음. 3시간 넘 길다..
10,넘 재미 있고 가족들이랑 같이 볼수있는영화 난 넘 좋았어요
10,감독님이 표현하고 싶은게 참 많았던 영화인거 같다 사실 더 길었어도 봤을 거 같은 영화 스토리도 메세지도 다 좋았다 애기 아바타가 제일 기억에 남는다 너무 귀여워 ..
10,?? ♥? ??
10,너무나 너무나 아름다웠어요!꼭 커다란 바다 안에 들어와 있는 기분이었습니다.2D 로 봐서 머리도 안 아프고 재밌게 봤어요!화장실 가는 타이밍 : 대령이 이크란 길들일 때!!다녀오심 됩니다 ^^영상미 때문에 스토리가 부족하다는 생각은 전혀 들지 않았습니다.
9,환상적인 영상미와 스케일이 돋보이는 감동적인 작품이었습니다.
10,좋은 영화 감사드립니다. 정말 최고였습니다!!아들과 영화에 대해서 오늘까지도 이야기 나누고 있네요~~ㅎㅎ
10,3D로 봤는데 너무 재밌었어요 2D로도 또 볼꺼에요 !! 천만 될것같아요
2,트랜스포머 감동편정도?
10,4D로는 완벽한 영상미!최고!3시간동안 안마의자에 있던 기분이랄까... 안마맛집추천
