영화평점,영화감상평
10,??????????너무재밌었다3시간이라 땀찬거빼곤
8,영상미 최고 ㅜㅜ 덕분에 애기랑 멜크
10,스토리에 부족한 면은 있습니다. 하지만 영상미가 그 모든것을 압도합니다. 영화 상영 내내 너무 행복했습니다. 이런 영화를 볼 수 있다는 것 자체가 저에겐 축복이었습니다. 아이맥스 강추
10,너무 재미있게 잘 보았습니다.저는 3시간이 길지 않았어요.영상들이 너무 멋지고 스토리도 너무좋네요.
10,용아맥 가서 재관람하고 싶다 ㅠㅠ미친 cg
10,두 말 할 필요가 없다. 영상미 하나 만으로도 극장에서 반드시 봐야 하는 영화.
9,카메론의 메카닉들 보는 재미가 쏠쏠 너무멋짐 디자인들이. 이영화 재미없게 보는사람들 아마 미술시간이 제일 싫었거나 미적감각 없는분들이 대부분일걸?
10,아쿠아리움에 온 듯한 느낌이었어요~~!!올해 최고의 영화입니다!!
10,넘 재밌음 5시간 해도 볼듯
10,개인적으로 영화가 너무너무 재밌고 영상미가 매우 좋다.
2,"스토리 억지, 영상미 100점"
10,스토리는 별거없는데 cg는 다른영화들 명함도 못내민다
1,"영상미'만' 좋았고, 시나리오 작가는 당장 해고해야 맞고 감독은 영상만 담당하게 해야함. 최근 디즈니 묻은 영화는 거르는게 정답. 개연성은 제로, 등장인물 매력 제로, 참신한 주제로 스토리는 완전 망함. 평점 1도 아까움. 아바타3는 볼일 없을거 같음. 외국에서는 폭망했고, 관련주 주가도 다 폭락했다는데 이해가 됨. 우리나라 사람들은 유행만 했다하면 우르르 몰려가서 무지성 극찬 밖에 할줄 모름... 제작비의 80프로는 그래픽, 20프로는 음악, 스토리에는 3백원정도 투자한거 같음. 내가 꾸는 꿈도 아바타보단 개연성 있고, 인간이랑 대령 지능은 고릴라 수준임. 그냥 보는 내내 답답하고 짜증남."
10,역대급 영화 아바타3 기대하겠음
6,엄청난 CG배우들의 연기는 너무 좋음하지만 굳이 5-6편..? 까지 만들어야 하나 싶을 정도로 루즈한 전개..인물의 서사시를 만들기 위한 과정이라고 본다면 3편을 기대해 봐야할듯.헌데 앞으로 전개 내용이 대충 예상은 되는데..시고니위버의 키리가 어떻게 저렇게 교감능력이 뛰어난지를 3편에서 더 풀어줬으면 좋겠음
10,영상미가 아주 화려함 리얼함과 참신함에 혀를 내두를정도. 3시간 이상의 러닝타임에 눈 뗄 틈이 없었다
10,3시간 시간 가는줄 모르고 봄
10,아바타2 물의길 러닝타임은길지만CG가 정말멋지고 화려했습니다.저도 아바타세상에서 살아보면 어떨까라는생각을해봅니다. 영화 정말잘만드렀습니다.
10,모든게 감동 그 자체입니다
10,진짜 꼭 보셈 돈 안 아까움 가성비
10,"스토리,기술력,배우들의 연기,깊은 감동,우리에게 전하는 메세지.어느 하나 부족함 못느끼고 3시간 푹 빠져 감상했습니다.이런 영화가 또 나올 수 있을래나 싶을 정도로 너무나 훌륭한 영화였어요"
10,너무나 자연스러운 영상미와 모션 연기에 엉성한 스토리라고 배부른 착각을 하시는게 아닐까요?오랜 기다림을 보상하느라 보여 준 모든 장면에 감동이였습니다.
8,자식들이 사고치고 엄마 아빠가 해결하는 영화 아오 저거저 로아크 답돌이 진짜
10,3D로 봤는데 넘 좋았음
10,스토리고 뭐고 됐고! 만쩜!!!!♡
8,"CG 아름다움. 영상미 연출 너무 좋음. 재밌었음. 하지만 인생 띵작이냐? 절대 높. 떡밥만 던지고 회수가 안된 부분도 있고 읭? 싶은 개연성 구멍이 여러번 보였음. 스파이더와 네이티리 관계 정리도 안됬고. 개인적으로 3D 말고 2D 강력 추천. 3D로 인해 화면 밝기, 색감, 해상도까지 손해보며 봐야할 정도로 그 효과가 대단한지 모르겠음."
10,3시간 짜리 외계인 다큐멘터리??? 이건 못참지 외계인 좋아하는분들은 무조건 보세요
10,그냥 모든게 완벽했던 영화 제임스 캐머런 감독이 무엇을 전하고자 하는지 너무나도 잘 와닿는 내용이었다.. 평생 잊혀지지 않을만큼 매번 스토리가 인상적이며 가치가 뛰어난 작품!!내 평생 최고의 영화
8,바다 풍경이 너무 아름답다.인간은 탐욕적이고 이기적인 인간은 지구에 너무나 유해하다...
10,볼만하고 강추합니다! 눈물 ㅠ
2,8.49정도가 정확함. 그래서 별하나줌
10,"효자 아이맥스로 봤어요..생각보다 3D 화려함은 없어요.. 그래도 아바타는 3D로 보시는걸 추천드려요..역시 아바타는 주변 풍경,신비로움.. 영상미는 최고인거같습니다.. 3시간10분 지루함 없이 너무 잘 봤습니다"
2,기대가 너무 커서 그런가요? 눈요김은 있었으나 1편에 비해 감동이 없었고 살짝 지루하네요
10,하 그냥 고민하지말고 보세요
10,대작... 인생에서 두번 없을 영화
10,"스토리적으로 진부할 수 있어요. 다만, 이런 경이로운 그래픽 요소를 보고도 스토리에만 집중할 필요가 있었을까요? 저는 너무 감명 깊게 봤습니다. 그동안의 스태프 노고가 너무나 잘 느껴졌네요. 3은 2보단 빨리 나와줬으면 하는 바람이 크지만 어쨌든 기대가 됩니다."
1,"3시간짜리 고퀄의 쓰레기이런 내용의 영화를 3시간동안 풀어놓을 정도..?이제 알겠으니까 빨리 끝내줘라는 생각을 몇번을 했는지 모름.영화는 우리 영상, CG 이정도까지 수준올라옴 ㅇㅇ잘하지? 라며 장기자랑하는 것 같은데..솔직히 아바타1이라는 후광때문이지 아바타1이랑 연관없이 개봉했으면 지금같은 평점 못나온다에 올인함."
10,진짜 최고의 영화 중 하나!!! 재밌게 잘봤습니다.
10,넘 재밌게봤네요.1편을 본지 넘 오래되서인지 초반엔 인물들이기억이 잘 안나 초반엔 뭐지 하면서 봤는데..갈수록 몰입도가~~정말 잘 만들었네요~~또한번 더 보러갈려구요~~^^
10,10점만점에 10점 감상평도 열자 이상
10,눈이 즐겁고 황홀했다... 다큐멘터리 보는 느낌. 지구를 더 사랑해줘야겠다. 인간이 제일 나쁨 ㅠ
10,영상미 최고 입니다 추천
10,걍걍걍 지림 꼭보셈 ㄹㅇ
10,별 흥미없이 봤다가 너무 재밌었습니다.
10,다섯시간짜리여도 안지루했을거에요 세시간반이 너무 짧았습니다 진짜 이번년도 최고영화에요
4,스토리 개연성 전혀없고 주인공 가족들 수족관 가이드인줄~~
10,"그냥 색상표현 한마디하겠다 ""보라"""
8,킹바타
10,압도적인 퀄리티의 영상미네요
1,아바타 시리즈 안보는데 유명해서 한번 본건데 와 3시간 엄청길고 스토리 뻔해보이는데 참고 보느라 죽는줄.. 중간에 화장실 갔다오고. 배안에서 에어포켓 찾는데 세월호 트라우마 생각나서 더 불편.. 그냥 스트레스 풀리는 액션 영화나 볼껄 ㅜㅜ 아바타 다신 안볼듯
10,삼편이 벌써부터 기대됨
7,사랑의 힘
10,3시간순삭이였다.보는즐거움최고
10,안좋은말 많았는데 재밌어요
10,피는 물보다 진한것이다.
1,너무 지루했다… 진짜 영화보다가 나가고 싶은적 처음…. 아바타 기대치가 높았던것도 있지만 너무 지루한 전개와 스토리 ㅜㅜ
10,진짜 제임스카메론 굉장하다
10,자연아 인간이 미안해..!
10,오랫만에 긴 시간 지루하지 않게 영화의 흐름에 내 감정이 웃고 울고 놀라고를 반복하는 대작을 맛봄.아주 재미짐.. 올해가 가기 전에 이 감동을 함께 나누길 바랍니다~!
10,아바타5 까지 볼랍니다 너무 재밋어요
10,저는 이런 판타지 장르 좋아 해서 1도 재밌게 봤었지만 2도 기대한 만큼 재밌게 본 것 같아요 ㅠㅠ 감정신도 있어서 더 몰입이 되었던 것 같아요.저희 엄마도 재밌다고 시간 가는줄 몰랐다고 하셨어요! 집 에서 티비로 나온다면 한 번 더 보고 싶어요
10,그냥 말이 필요없음영화끝나고도 여운이남아서 영화관을 못나가겠음 진짜 최고의 영화다
6,최고 예쁜cg도3시간 보다보면 힘들다.ㅜ어차피 장기상영 들어가면 관객수는채우겠지만 신선도 및 스토리는 별로다.
10,CG하나만큼은 물개박수가 나올만큼 대단한 영화
8,이민 후 아이들이 더 잘 적응해 엄빠도와주는 얘기
9,다음에는 4d 말고 3d로 봐야겠다는 결심. 그러니까 다음에도 또 볼거라는 결심. 4d의 기술력은 아직이라는 판단.
10,내가 이거 모바일로 안보고 꾹참고 극장가서 본 보람이있다. 탐욕에 꽉찬 인간은 자연앞에서는 괴물이고 쓰레기일뿐이다. 1편은 나의 인생영화 2편은 내아이와 나 우리가족의 인생영화가 되었다. 부디 내가 살아있는 생안에서 아바타가 완결되기를.. 평생 새로운시즌을 보고싶다.
10,정말최고
10,"누군가에게는 지루한 3시간일 수도 있지만, 가족의 사랑을 아바타라는 캐릭터로 풀어내는 세계관 속에 나 또한 감동받을 수밖에 없어지는 스토리같다. 스토리를 풀어내는 방식이 가족의 사랑의 깊이를 더 깊숙이 깨닫게 해주기때문에 대작이라고 느낀다"
10,세상에 강한 마음 갖고 지내자! 여운이 많이 남은 영화
10,진짜 작살나네! 1편을 극장에서못본걸후회하며 십여년을기다리다 중년이되서 사춘기아들과 함께봤습니다. 너무 멋지네요
10,ㅡ영상미~~너무이쁘네요^^
10,"ㅇ,,이게 어떻게 가능한거지,,, 어케 만든거임 진짜..??!!!???!?! 너무 재밌게 봤다 진짜ㅜㅜ 흥행하는 이유가 있네!!"
10,원본 포맷을 온전히 느낄수 있는 돌비시네마에서 보세요. 인생 띵작이 될 겁니다
2,아오.. 다큐멘터리인줄알았습니다그냥 스토리 완전 재미없고 하루종일 시간보고 잠만자고 그냥 그래픽 원툴영화.
10,진짜 가족의 소중함을 다시 깨닫게 해준 영화…! 3시간이 짧게 느껴질만큼 영상미가 뛰어났고 지루할 틈이 없었다 :)
10,제임스 카메론 기억을 아바타에 넣어서 평생 영화 만들게해야함
10,"최고의 영화. 평점 잘 안남기는데, 관람객 평점 올려주고 싶어서 남깁니다."
10,올해가 끝나기 전 처음으로 눈물 떨어진 영화…이 세상에 아바타 라는 영화가 나와줘서 감사합니다 진짜..
10,아바타 1보다 재밌게 봤습니다 ㅎㅎ초반은 조금 지루했는데 바다 영상부분부터 좋았습니다영화가 길어서 영화관에서 다시 보기는 어렵고 데즈니에 올라오면 다시 봐야겠어요 ㅎㅎ
6,"솔직히 영상미 그래픽 빼곤 ""내용이나 연기 연출"" 모두 진부하고 지루해요ㅠ 1이랑 크게 다르지 않은 스토리에 한국패치된 영화마냥 즙짜는 장면, 긴 액션신까지... 그 중 긴 상영시간이 너무 피로했음... 리클라이너 상영관에서 봤는데도 온몸의 피로도가 넘 높았음.. 진짜 중간에 쉬는시간 한 번 줘야 할 정도(진지) 이것때매 저는 너무 힘들어서 별 3개만 줍니다그래픽은 돈 바른 만큼 미쳤어요 진짜 바다 그래픽 끝내줍니다."
10,3시간이 하나도 안아깝고 또 보러가고싶음!!
10,아바타는 영화관에서
6,몇년을 기다렸는데....
9,너무 재미있었어요 기대를 저버리지않네요
6,음 재미는 있는데 이걸 3시간까지 끌었어야 하나? 스토리가 아쉬웠다. 대령의 부활을 겨우 이런 식으로 소모하다니. 대령이 에이와와 교감하고 자신이 인간이냐 나비족이냐의 정체성으로 고민도 하고 그런 장면이 더 있었으면 좋을 것 같았다. 아들 갑자기 살려주는 것도 개연성이 부족했다.
8,어쩌다 민폐가족이 됐는지.. 위험하게 자식은 왜 낳아서..
10,"영상미에 감동!!스토리는 평범하지만 이게 애니메이션이 아니라니!!!3D,큰 화면에서 보니 행복했어요."
10,"영상미, 스토리 내 생에 최고의 영화"
10,진짜 미쳤습니다 무조건 3D로 황홀경을 체험하시길
1,빈약한 스토리 지루한 전개다음 시리즈 볼 자신이 없다
10,전 생각보다 좋았습니다. 영상미 훌륭하고 내용도 좋았습니다. 3시간이 후딱 지나가네요!! 아이맥스 3D로 꼭 보세요.
10,영상미가 엄청나네요...보기전엔 3시간 러닝타임에 걱정 한가득이였는데..왠걸..시간가는줄 몰랐어요.
10,처음엔 영화 이상의 예술작품이라 생각했다. 그러나 그도 아니다. 이것은 지금까지 우리 세상에 없었던... 새로운 세상이다. 새로운 세상을 우리에게 너무도 리얼하고 충격적이고 감동적으로 경험시켜주는 그 무엇이다. 중반 이후부터 보는 내내 눈물을 멈출 수가 없었다. 너무도 아름답고 아름답고 아름다워서 감동과 재미를 제외하고도 그저 극도로 황홀하고 아름다웠다. 이런 경험을 하게 해주고 많은 것을 직접 느끼게 해준 감독과 제작진에게 너무도 감사했다. 이런 완벽한 작품이 또 다시 이 세상에 나올 수가 있을까.
10,최고다. 이사한 장면부터는 눈을 뗄수가 없었다
10,3디로 봤어요. 최고네요!!! 감히 현존하는 최고 영화라고 추천합니다. 3시간동안 한순간도 지루함없이 봤습니다. 전세계 국보급 감독입니다 !!!
2,지루합니다. 생각보다 별로.
1,너무 재미 없고 너무 무서고 만화애니 저럼 안무서개 해주시고 5기너무 많는 것같은데요.징그러고 별로에요.2기 많 했스면 좋겠네요.드라미는 평일 해스면 좋겠내요.애니는 주말 해스면 좋겠내요.
4,"바다생물 다큐멘터리 그이상 이하도 아님 일단 고향 떠나는 개연성 너무 떨어짐..,"
10,감동은 크게 없지만 영상미 하나는 진짜 미쳤다
10,진짜 평점안남기는데 짱입니다..
10,넘재미있게봤어요 3시간동안몰입이 아주. 추천합니다
10,미친 미친 미친 cg에 배우들 표정 연기랑 육해공 액션도 너무 좋았음 3시간이 전혀 지루하지 않음
10,"한산,공조2 로 날린 내 돈을 이걸로 전부 복구하는구나 와 ㅋㅋ 왜 영화관을 가야 하는지 그 답을 알려준다"
10,바다 속 풍경을 환상적으로 표현함 생동감 있음전혀 3시간이 지루하지 않아요가족애를 그려 청소년 자녀들과 같이 보면 좋을 듯해요
8,"[핫딜]판도라 3시간 속성코스여행, 단돈 2만원에 모십니다."
4,물의 나라로 이동.. 영상미 좋아하는 분은 좋아할듯
10,오랜만에 영화관에서 다시 보고싶다고 들게 해준 영화 마블의 피곤함에서 탈출하게 해준 고마운 작품
10,난 3시간이 어떻게 흘러가는지 모르고 봄정말 잼있음
10,말이 필요 없습니다. 진짜 최고의 영화 !!!
1,본 적 없는 CG 본 것 같은 스토리
10,영상미 연출 연기 다 좋아요~그중제일은 영상미지만~^^
9,20분정도는.. 줄일 수 있지않았을까..?그리고 3편은 10년 후에 내주시나요?
10,1편보다 더 재밋어요 감동 ㅠ
2,감동은 없다다만 화려한 영상미..1편에 비해 그닥~
10,13년 걸린 이유가 직접 가서 찍은 거였구나
4,영상미 좋음 하지만 상향 평준화로 영상미의 가치는 떨어졌다. 스토리 전개는 별로다. 3시간 중 지루하기 짝이 없다. 스토리의 개연성이 떨어지고 왜 혼난 후 가치는 알겠다만 똑같은 연출의 반복이다.
10,감동적임.시간 순식간에 지나감
10,보는즐거움이있는영화
10,됐고 빨리 3 내놔 더 기다리게 하지 마
10,너무 재밋네요 3편 기대됩니다.
6,너무지루하네요3D도 별로ㅠㅜ
10,13년을 기다린 보람이 있어요정말 재밌게 봤습니다중간 갑툭튀 조심하세요
10,명분허전이네요 허리가아픈거 빼고 감동입니다
10,영화라기보다 나비족 생활을 다룬 다큐에 가깝다어디가 cg인지도 모를정도로 고퀄이다영상미하나로 10점충분하다
10,"3D 관람 강추, 안경써도 강추, 온가족 영화 강추. 중간에 화장실 다녀와도 강추."
10,굳 오랜만에 재밌는 영화가 나왔네요
10,존잼 빨리 3 보고싶다구!!!!
10,개인마다 차이는 있겠지만 난 너무 너무 재밌다 내 딱취향 ??
9,"아바타1 때는 결혼안한 청년이었고, 13년이 지나 아바타2를 보는 나는 어느새 아이 둘의 아빠가 되었고, 그래서인지 설리의 시간과 함께 했던 거 같고, 가족을 향한 메시지는 더더욱 와닿았다.. 오랜 시간 후의 속편도 꼭 나쁜 것은 아닌 거 같다.."
10,"와 선생님 정말 그냥 이만 저만 말이 필요 없어요 !!! 미쳤어요 그냥 !!보는 동안 정말 행복 그 잡채,,진짜 진짜 진짜 역대급 영화입니다 다 보셨으면 좋겠어요 !!!정말 진심입니다 1분 1초라도 눈을 뗄 수가 없어요 진짜 한번 더 보고싶다한번이고 두번이고 천번이라도 볼 수 있을 듯 ,,3편까지 어떻게 기다리냐규 나의 최고의 영화 ~이런 명작은 무조건 영화관에서 봐야됌 ㅠㅠ 명품임 걍 !!! I LOVE"
10,??진짜 완전 재밌어요 3시간이 훅갔어요
10,3D의 끝을 보여준다. 최고의 선물.
6,너무 길다.. 3d눈아파요 ....
10,아바타3 존버한다 최고
8,아바타 1이 얼마나 잘만들었는지 알 수 있었어요
10,대박 최오 정말 상상이상
9,영상미가 대박이다. 스토리도 좋았음
1,왜 평점이높은지 이해안감.지루하고시간은 길어서화장실가고싶고..돈아까워서 않나가고계속앉아있었음
10,그냥 명작임 말이 필요없음 3D로 꼭보세요..
10,10년을 기다린 보람이 있네요!!
10,솔직히 티켓갚이 싼 편은 아니긴 하지만 영상미 하나만으로 충분히 돈갚해서 티켓갚에 바친 돈이 전혀 아깝지 않았습니다. 본인으로서는 무조건 강추합니다!
9,씨지가 엄청납니다. 감동적이에요
10,너무 환상적이고 영상미에 놀랐습니다
10,돌비 굿 영상미 굿 스토리도 나름 굿 가족영화추천
10,꿀잼입니다.꼭보세요
4,"보는 내내 주인공 가족 새끼들이 얼마나 트롤짓을 하던지 ., 그냥 주인공 가족이 민폐가족임.그냥 예쁜 그래픽으로만 보세요."
10,13년을. 기다린 보람있는 최애 띵작!!!
8,근래 한국 영화들 스토리가 워낙 훌륭하고 재밌다보니 그 수준에 익숙해져서인지 아바타2는 엄청 높은 점수를 못주겠다. 딱 8점이 적당한듯. 3D로 봤는데 입체감이 주는 신비함은 역시나 놀라웠지만 뭔가 대단하다는 느낌은 안들었음.
10,기대는 안했는데 너무 재미있음 ㅠ. ㅠ 감정이격해져서 울기도 했네요
10,"이 멋진 영화를 요 돈 내고 본다는게 미안할 정도, 기다린 보람이 있네요"
1,걍 스토리 안보고 아쿠아리움이라 생각해야함 개연성 스토리 다 못잡음
2,아.... 내가 돈을 주고 이걸 보다니...
1,누가 대작이라고 했냐 내용전개 별로니까 영상미가 좋아보일뿐 영상미도 미친정도는 아님
1,진자 재미너무없고 스토리 너무 간단하고
10,9점이상은 됨 솔직히 …..
10,3시간이나 봤는데 극장을 나오면서 더 보고 싶어 아쉬웠다.
10,대작입니다 너무 재밌었고 영상미도 뛰어납니다 몽환적인느낌이고 감동적입니다액션도 사이다고 너무 만족해서 한번 더 보러갈까 생각중이에요 어머니도 너무 재밌다고 하셨어요
10,최고입니다. 눈이즐거웠어요
10,3D 강력 추천합니다.
10,세시간아니고 두시간본느낌 지겹지않고 재밌네요
10,잼씁니다진짜 저는 완전 호
10,귇긓ㄱㄷㄱ슨흔븝ㄴ브7txr6x8cy9coycifxixxurzruxitx
6,광고포함 3시30분; 영화가 길긴 드럽게 길더라구요 보다가 나도 모르게 잠듦.초반 워딩이 거의 2시간에 육박 지루하고 또 지루하고 후반 물씬이랑 싸움씬에서 집중 하니 한시간 후딱 지났는데도 엔딩까지 20분이나 남음ㅋㅋ 무조건 3D추천이고 2D는 완전 졸렸을듯..리클라이너인데도 등허리 배기고 통증이 ㄷㄷ 초딩이랑 같이 봤는데 끝나고 애가 하는말 이건 완전 애니메이션 같다 ㅎㅎㅎ
10,생각보다 너무 재밌었다! 스토리는 좀 뻔했지만 그걸 넘어서는 영상미?!
10,시간순삭~가족영화잘봤습니다.
10,평점은 왜보러왔음?형믿고 걍 보러가~
9,긴 시간의 러닝타임이 가치있게 느껴진 영화 였습니다.올해 최고의 영화
10,역시는 역시. 어떻게 시간이 지나갔는지 모르겠음.
10,재밋게봣고 아름다운영화에요
10,너무재미따 CG진짜 쩔어요ㅜㅜ3D로 1열 중간에서 봤는데 웅장 그 잡채꼭 3D로 보세요
9,가족과 함께 보면 좋을거같에요
10,역시 제임스 카메론. 감사합니다.
10,너무너무 재밌게 봤어요
10,"후반부에 울컥울컥 . 지나보니 긴 시간인줄 모를정도, 존재의 인정. 가족이라는 유대감으로 웅장했다."
10,와 진짜 좋았어요 2023년 최고의 작품
2,돈벌어야 후속작 만든다고 해놓고영화는 후속을 위한 예고편으로만만들어서 개망 ㅋㅋㅋㅋ이라서 돈 벌겠냐 ㅂㅅ들아
10,아바타1도 재밌게 봐서 2도 재밌었음CG가 진짜 미친듯
10,영상미 수준높은 연기 3시간 넘은게 시간가는줄 몰랐습니다~~3편이 기대가 됩니다
8,반드시 극장에서 보아야하는 영화
10,판도라 올로케 이해가 갑니다
8,영상미는 훌륭해서 영화값 낸돈은 하지만 스토리 아쉽.... 중간에도 자를수있는 내용도 한시간분량에.. 전투씬보다 졸음 정작 전투는 40분함
10,아이들과 재미있게 봤네요
7,영상은 화려하다. 하지만 스토리 깊이에 비해 너무 길다....후속편을 기대하게 하는 연출은 괜찮았다.
10,20000원으로 판도라도 가는 시대
3,"영상미 예쁜 것들만 잔뜩 보여주면서 관객들한테 ""어때? 예쁘지?""하고 몇십번 물어보는 듯한 느낌을 주는 영화. 액션 가족애 스토리 뭐하나 잡은게 없음"
8,3편 기다려야해서 별하나 뺏어요
2,억지줄거리..몰입하나도 안되고 뭐 어쩌자는건지cg만 잘하면되나? 그게영환가? 0점이 있다면 0점 주고싶을정도
6,소문난 잔치집에 먹을거 없다
8,영상미의 끝판왕 3시간동안 놀이기구 잘타고 왔네요
10,연출도 좋고 굉장히 재밌어요
10,인간은 다 없어져야돼 ㅠ ㅠ
9,재밌긴한데 너무 길어요.. 충분히 줄일수 있어보이던데길어서 오히려 마이너스인 영화 1편이랑 비슷하게재밌긴함
8,스토리는 1편.뻔한 스토리... 하지만 영상은 2편...3편은 언제 나올려나?
6,바다 다큐에..람보 ...
9,정말 무에서 유를 창조한 영화 실사보다 더 실사같은~~3시간 런닝타임이 길다고 느껴지지 않았네요!!!
2,너무 쓸대없이 내용이 길어서 지루함 3줄요약이면 스토리는 충분하다
10,내가선택할수있는점수는100점이다.
8,3d로 생생하게 봐서 재밌었음 근데 영화가 3시간짜리려서 중간에 멀미가 꽤 생겼었음
10,이거 보고 재밌다는 것들은 너네 가족 사냥 당할 때도 웃어봐라
10,CG와 연기 스토리까지 모든게 완벽한 영화입니다
10,Cg가 ㅁㅊ음 아바타3 기대할게여
10,근4년동안 본 영화중에 단연1등지루할시간이 없음..완벽
10,시간가는지 모르고 봤어요 가족애를 느낄수있는 감동적인 영화였어요
10,오늘 영화 보고 왔는데 너무 재밌었고요 기대 이상으로 스케일도 컸고 웅장해서 좋았던 것 같습니다.^^ 얼른 시간이 지나서 검도판 나온 걸로 다운 받아서 계속 보고 싶네요.
10,넘 잼고 볼거리 진짜 많네요 짱짱!!!!
10,몇번이나 울린 영화너무 재밌어요
7,1편 보다는 아쉽네요영상미는 굿~~!!
10,진짜 돈 많이 쓴 티가 난다.. 올해 본 영화 중에 단연 베스트인듯
10,살아생전 이런 비주얼의 영화를 본다는게 영광이다. 3편은 카메론 감독이 살아있을지…
8,다큐보는 느낌이라 너무 좋았음진짜 어느한 행성의 실제 가족을 담은것같음그래픽은 말할것도 없고 영화관에서 보라고 만든영화!! 아바타 최고!!!ㅎㅎ
10,최고다 더 할 말이 없다 감동 그 자체인 영화
10,역시나... 아바타는 아바타다용산 아이맥스에서 봤는데 미쳤습니다.. 뭐가 어떤면이 부족하다 어떻다 하는 글들 있던터라사실 약간 걱정도 하면서 들어갔는데엥? 알바들인가 싶을 정도로 어마어마 했습니다
9,극장이 존재하는 이유
10,정성화가 다했다. 킹작. 꾹꾹 참았는데 문희누나때문에 온영화관이 울음 바다가 된 영화
8,1편보다 조금 아쉽네요
10,한번도 평점 남긴적 없는데 정말 이건 안남길수가 없어요. 너무 재밌고 너무 멋지고… 또 보고싶어요!!!
10,아이.. 씨.. 유..
10,ㅏ초라ㅗ타ㅛ탛타ㅗ토타툐쵸ㅐ
10,아바타2 기다릴만 했다
10,진심 5년만에 영화관 갔엇고 반지의제왕 이후로 긴영화첨 보는데 시간되면 보세요
