영화평점,영화감상평
10,3시간 뻥이에요 한시간반 조금 안되는거같던데..
6,돈아깝지는 않아요 너무 기대를 많이 했나봄
10,제임스카메론에게 감사의 박수를 보낸다. 영화관 존재의 이유.
10,런닝타임이 길어도 재밌었어요
10,꿀잼인데요 제가 지금은한테는한테
10,돈이 술술 녹네 내 입속으로 오라오라오라
10,지루하다는 평에 약간 걱정하고 관람했는데 전혀 지루하지 않았음 심지어 영화관 잠순이 울 와이프도 끝까지 완람함 너무너무 재밌었음
10,일단 엄청 잘 만든 영화에요 빼어난 영상미와 감동까지일부 유튜버들 엄청 까는데이해가 안가네요.물론 스토리는 뻔하지만..
4,"이 스토리가 10년이나 만들만한 스토리인가? 10년동안 무슨 cg작업만 함? 납치됐다 풀려놨다 납치됐다 풀려놨다 계속 똑같은 클리셰에 둘째라는 놈은 계속 빌런짓 쳐하다 형 OOO, 계속 구하러 간다고 빌런짓 하다가 마지막에 동생들 붙잡힌건 그냥 가야한다고 갑자기 180도 달라진 태도를 보이지를 않나 ㄹㅇㅋㅋ 이게 재밌다 하는 애들은 스토리 보는 수준이 낮은거임."
10,존잼이야...ㅠㅠㅠ
6,솔직히 넘 지루함;;;
10,오래기다린 보람이 있네요~ 가족끼리 4DX로 즐겁고 재미있게 관람하고 왔어요~ 여운이 오래 남아요~
1,저만 재미없나요..? 저만 재미없었나봐요 다들 재밌다고 난린데 전 보다 지루하고 재미없어서 중간에 잤네요… 3시간 엄청 길고…
10,진짜 너무 재밌어요 이거보고 취미가 영화보기가 됬어요
10,영상이 아름다웠어요다시1편 또봐야겠어요~~
10,"12년 기다릴만했네요.. 긴 시간이긴 했지만, 너무 아름다워서 한 순간도 지루할 틈이 없었어요.. 인간의 상상력의 한계는 어디까지일까요? 이런 작품이 어떻게 머리에서 나오는지 참 대단합니다…"
9,"평면적인 스토리라고 하지만, 지구 환경의 위기가 뜨거운 감자로 떠오르는 이 때 너무나 시의적절한 영화 아닌가"
10,고양이 하악질 보고 만든영화인건가요?톨쿤인가 툴쿤인가 개가 다했다고 봅니다하늘 과 땅이 같이 싸우는걸 기대했지만..
10,올렬롤롤롤로롤로롤끼야우
2,존나 유치함. 애들 영화임.
6,기대에 못 미치는 영화?
10,영상미 연기 전부 좋았음 현지 로케 촬영장소 가보고 싶은 느낌
6,3시간짜리 아쿠아리움
10,또 보러 가고싶을만큼 좋았어요
10,cg가 일단 넘사벽이고 이뻐요ㅠㅠ 3d로 봐서 몰입감도 더 좋았어요. 스토리도 감동적입니다. 너무 재밌게 봤는데 평점이 왜 낮은건지 모르겠어요.
10,감히 인생 영화가 될 것 같아요
9,13년의 기다림이 헛되지 않았다.
10,2009년에 봤던 그 충격을 다시 2022년에 느꼈다 정말 잘 만든 영화
10,"연출, 연기, 모든 게 최고 였음."
10,최고에요 역시 재밌슴니다
10,영화관에서 보길잘했다ㅋ
10,"영상미야 두말하면 잔소리고, 계속 내세우는 가족의 의미. 진부하지만, 자녀가 있는 아빠로서 정말 감동이었다...."
10,방금 보고왔는데 또 보고싶어요.. 세시간이 너무 짧앗음 ! 언제쯤 다운받아서 볼수있을까요..?
10,1편에 비해 별로라는 얘기를 들어서 기대안하고 갔는데 왠걸 ㅠㅠ너무 재밌어서 세시간이 어떻게 가는지도 모르게봤어요! 뻔해보이는 스토리를 이렇게 재밌게 표현한 것도 대단하다고생각합니다! 짱짱
10,진짜 가족하고 봐도 좋을 영화영상미 압권이었다
10,영화관이 존재하는 이유
10,아바타 역시 명작 내용 별로라고해서 기대 안했더니 더 좋았음
10,잼있당 잼있당 영화관에서 봐야지
10,한번의 감상으론 부족한 영화 입니다
10,그냥대박이엇슴짱..
10,나비족이 정말 잘싸움 ㅎㅎ 사람들이 1편이 더 재미있다고 하던데 1편을 안본 나로썬 2편이 이렇게 재미있는데 세상에 1편은 얼마나 재밌다는건가~~!!?!?!
8,기대했던 대로 영상미와 제임스 카메론의 연출은 굉장했습니다. 하지만 빈약한 스토리와 너무 긴 상영시간이 보는 것을 피로하게 합니다. 장점이 확실한 만큼 단점도 명확한 것 같습니다.
10,정말 지루하게 느껴지지않은 최고의 영화. 스토리.영상 등 모두 좋았어요 최고
1,"무엇을 중점으로 둔지 이해가 안되는 영화.몇년을 준비했다기엔 낮은 퀄리티.1보다 약한 액션신과 CG,브금 왜 넣었는지도 모르겠는 장면과 스토리"
8,아쿠아리움 미장셴은 3D로 봐야...
10,영상미 말고 볼거 없다는 사람들 말에기대를 안해서였던건진 몰라도너무 좋았어요3D로 보시는거 추천 드려요그리고 생각보다 좀 앞쪽에서 보시는게오히려 신의 한수 입니다 가득하게 보는거요그냥 두번도 볼거 같습니다
10,뛰어난 영상미로 몰입감이 최고
8,10년전 아바타1의 충격에 비하면 실망스럽지만절대적으로 보면 괜찮은 영화
10,아바타5까지 가기 위한 빌드업 과정이라 스토리는 조금 아쉽긴하지만 영화 보는 내내 즐거웠고 다음 시리즈가 너무나 기대되었습니다. 최고입니다.
9,내용은 단순합니다 3D 영상미만으로도 충분히 안보신분들의 시간이랑 표값은 합니다~~
10,정말 최고의 영화 이런걸 영화관에서 볼수있어 영광이었습니다
10,아바타 수족관에 온 기분. 타이타닉에 이은 감독의 바다 사랑이 느껴짐
10,1편을 재밌게 보신분이라면 무조건 보세요!!!
10,그저 판도라 행성 자체의 세계관이 너무 맘에들고 아름답다. 동물들도 귀엽고 나비족과 더불어 사는 모습 자체가 보기좋아서 그것만으로 항상 후속작이 기다려졌었고 13년만에 다시보는 판도라행성은 너무 예쁘고 만족스러웠다.
8,3시간이 넘는 긴 영화지만 별로 지루하진 않고 재밌게 볼만하다. 딱 이정도.
6,1편에 비하면 시간 때우기용
1,아바타 1도 스토리가 있는 편은 아니었지만 2는 정말 찍어놓은 게 아까워서 넣은 게 아닌가 싶을 정도로 계속 똑같는 내용의 연속이었어요. 한명이 끌려가면 또 찾으러 갔다가 다같이 잡혀서 또 다른 가족들이 구하러 갔다가 또 잡히고ㅡ 지루했습니다.영상이 예쁘긴 했지만 그게 다였고 러닝타임만 너무 길어서 3시간이 너무 아깝게 느껴졌습니다.
10,진짜 최고입니다 꼭 보세요 감탄만 나오세요
9,판도라 체험이 기가막혔어요
6,전편은 재밌게 봤던거 같은데 스토리가 별로였고 결말도 좀 이상해서 아쉬움
1,문명이발전하고 날라다녀도 피할수없는 4천억짜리 조폭사시미엔딩
10,물속 물고기들 구경가능 스노쿨링 하는 기분이 들어요 ㅎㅎ 영상미 정말 대단하고.. 예전의 아바타처럼 이름 값 하네요 스토리 질질 끄는 느낌도 있는데후반엔 정말 집중해서 봤어요 !! 추천
10,아름다운영상미덕에더잼나게봤습니다
6,비주얼은 최상급이나 스토리는 별로.
10,4D로 봤습니다. 눈이 즐거웠어요 재밌습니다
8,하늘보단 물이 더 좋았다!!
9,시간 가는줄 모르고 재밌게 봤습니다.
7,영상미가 너무 쩔어요다만 스토리는 신경 끄고 봐야해요..
8,재미없다기에 기대 없이 봐서인지 매우 만족스런 영화. 더불어 세상에서 제일 큰 수족관을 체험한 느낌. 굿
10,역대 최고의 영화였어요.... 안 보면 후회 할 작품이네요~~~^^
10,관람이 아닌 체험이라는 말이 맞다는 것을 확인함
8,진짜 아들이 악당이였네
8,영화 재미 있네요 3시간은 어우… 아바타1도 봤는데 너무 괜찮더라고요
10,우리 엄마 소녀 같이 와~ 와~ 하시는데그 이상 무얼 바라겠소 ^^부모님 꼭 보여드리세요 3D로요
7,"아바타 1. 트루 라이즈. 어비스. 터미네이터 1&2. 에어리언2만큼 창작적이지 못하다. 비쥬얼은 좋지만 아바타 1만큼 충격적이지도 않고 특이한 외계인도 아니고 아프리카 종족을 아바타로 돌고래와 고래와 거북이등을 아바타행성의 동물로... 제임스 카메론이 심해와 바다를 사랑하는 것은 알지만 문명사회를 가해자로 토속문명과 그들을 피해자로 그리고픈 심정도 알겠는데 그래픽도 스토리도 13년이라는 시간을 생각하면 발전시켰다고 말하기는 어렵다. 아바타 1의 완성도에 제임스 카메론에 대한 팬으로서의 충성심에 그의 작품에 대한 동경심에 봤는데 코로나가 너무 많은 것을 바꾸어놔서 즐길 문화생활도 줄어들었고 중국때문에 뭔가 끝나지 않은듯한 코로나시기에 이만큼 이목을 끌 대작에 목말라왔기에 오매불망 13년간 후속작을 기다렸는데 발전한 관객수준을 13년전 수준이라고 오판하고 만든다면 3편~5편까지의 흥행은 하겠지만 재미는 없고 눈만 즐거운 유아용 영화수준에 머물지도 모르겠다. 이런식으로 만화영화처럼 만든다면 배우들 고생시키지 않고 그래픽으로 만들고 성우만 했어도 되는 영화를 13년전 방식을 고수하고자 했는지 모르지만 바다의 질감이랄까? 그런 부분을 빼면 감동이 없다. 주인공 가족구성원도 사회성이 너무 없는 민폐가족이다. 언옵타늄이 필요한 인류의 배신자이기도 한 주인공이니 뜬금없이 바다종족에게 찾아가 같이 살게 해달라는 것도 실소를 자아내지만 자기 가족만 살면 되고 타종족의 가족들은 자기 가족들로 인해 죽던지 말던지 그 정도 민폐쯤이야 대수롭지 않은 모양이다. 제임스 카메론은 원래 주특기인 트루 라이즈. 어비스. 터미네이터 1&2. 에어리언2 같은 영화로 돌아가는 것이 나을듯 싶다. 아바타 1은 좋았다. 스필버그처럼 다양한 영화를 만들기엔 이제 나이도 많고 흥행의 대감독이 되다보니 자신이 집착하는 영화에서 벗어나지 못할듯 싶다. 어비스와 심해, 해저 다큐 2편과 아바타 2까지 바다에 너무 집착하는데 13년을 기다린 관객들은 감독 자신이 좋아하는 바다해저탐구영역의 취미대상이 아니다."
7,재밌긴 재밌었지만 1편보다 조금 부족하네요.살짝 지루했습니다.너무 싸우는 장면이 많더군요.극장에서 보는데 시간이 길어서 힘들었습니다.
10,무엇을 상상하든 그 이상을 보게 될 것이다.
10,아바타1 안보고 갔는데 크게 상관없고 영상미에 놀라고 연기력 연출 등 모든게 완벽해서 3시간이 그냥 흘렀습니다. 2D로 봤는데 3D는 장난아닐것 같아요 왜 대작은 대작인지 알 것 같은..아바타1도 봐야겠어요!
10,고도로 발달한 영상기술은 개연성과 구분할 수 없다.
10,자식이 웬수다. 무자식이 상팔자
9,연출과 영상미가 좋았네요 ㅎㅎㅎ
10,영상 보기 좋음 게임 같기도 함
10,최고였습니다. 3시간이 후딱
8,남양주 돌비로 관람했습니다... 영상미 하나로 감동그자체
10,"정말 재미있지만, 3시간은 힘드네요.하지만 지금 개봉작 중엔 원탑"
6,3시간 넘음... ㄷㄷ 1시 반에 시작했는데 거의 5시에 끝남. 화면이 너무 화려해서 눈아프고 계속 싸워서 좀 질린다. 그래도 그래픽 하나는 역시 아바타
10,영화가 아니라 인간 문명의 발전 정도를 보고왔습니다.
10,1편과는 또 다른 감동..
10,메세지에 집중하라.
10,볼거리가 무궁무진합니다. 3시간이 30분처럼 느껴지는 영화.
10,"못하는거는 과감하게 버리고, 잘하는거에 최대한 집중해 쏟아부은 제임스 카메론"
10,저퀄로 3시간10분이 가능하단게..ㄷㄷ
7,씨지 멋진데 몇군데 이해안되는 요소와 뻔한 스토리 전개에 좀 식상했음 쓰리디를 세시간 보려니 멀미나서 힘들었음 그래도 추후 시리즈가 개봉되면 영화관에서 볼것임ㅋ
8,아쿠아리움 체험관과 타이타닉 어드벤처의 조합
10,"역시 아바타.. 전율이 있었고, 감동적이고, 영상미 너무 좋았고 전 3시간이 길게 느껴지지 않았어요. 오히려 이런 영화 3시간 동안 볼 수 있어서 너무 좋았네요. 못 보신 분들은 꼭 보셨으면 좋겠습니다."
4,Cg와 영상미는 매우 좋았으나 스토리가 전반적으로 아쉬웠다.. 떡밥을 풀어놓고 회수를 안하고 마지막 물부족 부대는 갑자기 어디로 사라진건지...
10,엄마가 각성하면 무섭다.
10,기대한만큼 재밌어요.
10,ㅜㅜㅜ너무 재밌음....화려한 영상미....
10,3D 연출과 영상미 면에서는 압도적 1위다. 영상미 하나 때문에 영화관에 두번 가서 봐도 충분히 값어치 있음. 3시간이 금방 갈 정도로 영상에 빠져서 봤음. 예쁜 영상 보면서 힐링한 느낌.마치 내가 스노클링 하고 온 느낌까지 든다. 여운이 오래간다!
5,저걸 도대체 어떻게 만들었을까 싶은 엄청난 영상미가 있으나 스토리를 중요시하는 저로서는 영화가 많이 실망스러웠습니다. 스토리 전개가 매우 답답했고 단순했습니다.
10,아쿠아리움을 23000원내고 3시간동안 보는거면 그리 비싸진 않겠누
10,너무 아름 다웠어요~다시보고 싶어요^^
10,그냥 보세요..미쳤습니다
2,아동용 만화에 고급 cg영상과 오케스트라 음향을 입혀놓은 것 같은 부조화. 처음엔 어지럽다가 조금후엔 지루하고 나중엔 피곤해지네요.
10,"기다린 보람, 또다른 기다림의 기대"
10,역시 최고임 인생 영화시리즈
10,진짜 해양동물 불법 사냥하는 사람들 부디 뒈지시길ㅠㅜㅜ 영상미도 좋고 재밌어서 3시간이 순삭이었어요ㅠㅜ
10,Cg 보느라 시간 가는줄 몰랐네요
6,옛날 인디언 영화 보는 줄
8,"으마으마한 영상미와 기술, 자본력아주 평면적인 스토리. 가족애 범벅이라 조금 식상하고 촌스런 스토리. 이야기가 궁금치는 않았음. 아 그렇지만 볼거라면 무조건 극장에서 봐야하는...왜 우리는 극장을 가야하는가에대한 대답같은 영화"
8,좋은 영상이지만 좋은 영화인지는 잘 모르겠다.
10,"모든영화가 그렇듯 장단점이있지만, 이영화는 아이맥스 극장이 존재하는이유. 9점미만은 뭐지?"
8,아바타는 영화관에서 ㅋ
7,1편처럼 깔끔한 전개가 아니라 후반부로 갈 수록 너무 질질 끄는것 같았네요 조금 아쉬워요.
10,보다가 지루해서 중간에 나갔다고 이야기하는분도 있던데... 그말이 팩트가 맞을까 의문임 ㅋㅋ설연휴 피크타임에 봤는데도 나가는사람 한명도 없었고 몰입해서 웃음포인트에서 웃고 ㅋㅋ 3시간이 너무 빨리지나갔다..너무 재밋고 좋닸다~!!
10,역시 아바타.. 다음 작이 기대됩니다.
4,솔직히 기대가 너무 컸나보다 1도 재미없었는데 2는 러닝타임만 너무 길고 감동도 느낀바도 없었다
5,와이프는 재미있다는데 저는 잘 모르겠네요보는 내내 지루했어요
10,이번에는 바닷속 이야기 재밌음
10,재밌어요 상영시간이 짧게느껴졌어요
10,영상미가 너무 좋아서 3시간이 후딱 지나갔어요 3D로 또 보고싶어요 강추
8,내용은 많지 않으나 마지막에 감동이 있어요 영상미는 좋아요 근데 너무 영상미에만 치우친거같긴해요
10,"압도적인 3시간 아이맥스, 돌비등의 특별관 표값을해줌"
10,너무 재밌게 잘봤다 큰아들 죽은거 맘 아팠다 시간 가는줄 모르고 봤다
10,3시간 내내 보는 눈이 즐거웠음바다라는 소재가 정말 신의 한수임
10,누가 지루하다했노 잘만들었고 재밋기만하구만
8,이야기가 재미없어도 볼만할 수 있다.
10,1편에 비해 손색없고 넘 아름다운 영화
10,부모의 입장에 너무 공감이 되어져서 중간에 눈물도 나오더라구요재미있게 보았습니다. 한번 더 보고 싶네요
10,"3시간이 금방감, 오랜만에 최고의 영화였습니다."
10,영상미최고 영화 다운 영화
10,역시재밌네요 아바타~
10,cg에 감동하며 봤고 긴 시간동안 크게문제 없이 봤습니다.다만 이번 롯데동래점에서 보았는데 사람들이 그렇게 시끄럽고 전화기 알람 울리고 해서 힘들었지 영와는 굿~!!
10,이거는 절대로 불호가 갈릴수 없어요너무 감동적이에요 그리고 스케일이 정말 말로 표현을 못할거같아요 너무 좋아요ㅠㅜ 아까 봤는데도 또 보고싶어져요 ㅠㅜ
10,진짜 대박이네 연기 대박 잘 함
10,난 재미있던데.. 왜 평점 점점 떨어지냐
8,동화책 수준의 스토리에 잠시 졸린 순간도 있었지만 그래픽은 명불허전이었어요. 지구별 사람과 나비족 간에 극명한 흑백 구도와 가족애를 주제로 다루는거라 평범한 줄거리가 이해는 되지만 진짜 너무 밋밋하긴 했습니다.
6,영상보러 영화관 갔는데 영상도 별로 스토리도 별로. 액션영화보고 온 느낌. 너무 길고 지루.1편에서 끝났음 좋았겠다. 후속작이 또 나오겠군. 에잇
10,첫째가 너무안타까웠고 그래도 이겨서 다행인데 시즌3도 있을까?? 시즌1때 죽은 애의 아바타가 살아있으니까. 제발 이제는 착하게 그런 생각말고 살아라 제발!!!
10,3시간러닝타임...보기전에 화장실두 억지로 감
9,끝 내용때문에 속 시원하게 보지는 못했지만 판도라 세계의 확장과 미친듯한 영상미로 정말 멋있었던 영화. 3편 가나요?
2,존나 유치하고 길다 시간 아깝다
10,이게 영화다 라는 것을 모두 보여준다
6,전체적인 스토리는 좋은데 너무 시간이 김 지루하다
10,아마 카메론감독님이 아니었다면 제생전 이런 영상을 절대 못봤을거라 장담합니다 마블의 앤드게임조차도 유치원재롱잔치로 보이게만들만큼 압도적인 영상.. 이건 감상이 아니라 체험입니다 후아..
9,영상미가 다 한 작품인류사 발전의 한 부분
10,영상미 보는 재미 연기 보는 재미
10,현시대 최고 스케일! 감동적임
10,제임스카메론 정말 대단하다 다들보고나면 또 생각날겁니다
10,13년전 1편은 충격이었다면 2편은 감동과 완성도 스토리 모두 더 발전한 영화입니다.
8,영상미 하나만으로 극장에서 관람 추천!!!
10,재밌다.. 마지막에 좀 짜증남
6,"확실히 1편 봤을때 그 엄청난 감동은 없었지만영상,cg 이런면은 역시 아바타였다"
10,재밌었어요 영화관에서 어떤 할머니가 전화를 두통이나 해서 짜증났지만
8,"CG, 연기, 스토리 등 모든 면이 준비가 잘된 것 같고, 또 따로따로 잘하는 게 아니라 조화롭게 잘하는 갓 같네요.여러 요소를 다 신경쓰면 세세하게 하기 힘들텐데 거슬리는 부분도 없었고 스토리도 매끄럽게 흘러간 편 같아요"
10,아바타3도 너무 기대돼요!!
10,판도라 랜선여행 다녀온 기분! 감독 최고
10,진짜 너무 재밌다.최고의 명작
4,"침략자에 맞서가족을 지키려는 원주민 이야기. ""늑대와 함께 춤을""이 훨씬 낫다."
6,3시간짜리영화라서 보다가 잠들었다
8,별세계로의 여행. 성공적. 심지어 3시간짜리가 재미있기까지 함..여러 맥락에서 혀를 내두르게 함... 3d 아이맥스 강추
6,부족간의 갈등 부족..늘어지는 전투씬..대규모 전투하는데 아무도 개입없는 이상한 개연성..영상미를 위한 영화(수족관 영화)
10,꼭보세요~~~스토리좋아요
10,"감동이고, 경이롭네요. 다시 또 볼꺼에요."
10,감동그자체 마음속 깊은곳까지 따뜻함 굿
10,아니 재밌는데 왜그럼ㅠㅠㅠ
10,배우들의 연기어대한 몰입감도 좋고 스토리도 좋아서 초반에 졸긴했지만 재미있게 봤어요
7,새로운것은 없어도 거장의 연출은 역시나 명불허전이다. 그래도 러닝타임이 길...
9,재이나요
10,지루함없이 아이와 재미나게 봤습니다
10,마지막이 너무 감동적이였습니다.
1,스토리가 너무 진부하게 질질 끌리는것 같아요
10,"너무너무너무 재밌는데, 3편이 기다려짐."
10,재밌다.정말 재밌다.진짜로 재밌다
6,스토리는. 그닥 진행 되지도 않고... 멋진 영상의 네셔널 지오그래픽을 3시간 동안 본 느낌이네요. 아무리 영상이 좋아도 3시간 보면 물려요. 스토리도 없이 3시간동안 같은 장면 보면서 물멍 하는 느낌.입니다. 아바타3는 확실히 망할꺼라고 예언할 수 있어요.
8,그래픽이든 스토리든 다큐멘터리 보는듯한 느낌
10,13년의 기다림...무슨일이던 한가지를 꾸준히 하면 그분야의 장인이 되는듯 재미 감동 모두 받았습니다 3시간동안 가상이 아닌 실재를 경험하게 해주어서 최고의 영화 중 하나였습니다. 매우 추천합니다
10,"감독님, 만수무강 하세요~"
10,정말 시간가는줄 모르게 끝내줬어요
6,13년이 지났지만 그대로인 느낌?? 13년 전엔 신선한 스토리도 있었지만... 지금은???
2,정말 이건 아닌거같다... 왠만함 평점같은거 안하는데...
10,2D로 봤는데 아쉬워서 3디로 다시볼까 생각중!3시간이 언제갔는지?카메론감독 대단해요~~!^^
6,"뛰어난 영상미, 너무 유치한 서사와 클리셰의 남발의미없는 긴장감 조성.다큐멘터리로 방향을 트는게 좋지 않을까"
10,말로 표현할 수 없을정도. 최고다
10,일단 보는 것 만으로도 가치는 있었다고 생각
9,이해할 수 없는 씬이나 상황이 있지만 영상이 너무 좋아 커버 가능. 초반과 후반엔 살짝 지루하고 엉덩이가 아팠지만 전투 장면이나 그밖에 영상이 너무 멋있었음.
9,내용도 뻔했다 감동도 그저그랬고 하지만 뛰어난 영상미 하나만으로 저별점을 줄수있다3d는 영화관에서만 관람가능하기때문에 3d추천합니다
10,그래픽 좋아요. 스토리도 끊김없이 연결되서 자연스럽게 감상했어요.
10,3시간이라고 느껴지지 않았음. 불필요한 장면이 하나도 없었음. 아쉬운 점은 키리 목소리가 70대라는거.. 연기까지는그렇다쳐도 목소리는 아니잖아요...
9,눈의 즐거워요
10,10년만에 봐도 역시 기대를 저버리지않는
6,그냥 그저그래요 그랙픽은좋은데
1,3시간동안 나자신과의 싸움
7,나쁘진 않은데 그래도 러닝타임이 너무 길긴 하다..
10,나중에 내가 엄마였기 때문에 격공하면서 울 수 밖이 없었다. 영상미만 있는 줄 알았었는데.. son for son. 기억에 남는 대사. 잊을 수 없음
1,평점이 너무높아서 원래 5점짜린데 1점줍니다.. 아바타1 팬으로써 아바타2는.. 너무 재미없었어요 ㅡㅡ;; 차라리 영화 한산이 백배 천배 더 재미있습니다.. 그냥 재미가 없어요..;
10,CG 미쳤고 그냥 꼭 봐야되는 영화제 인생엉화ㅔ
10,한번보고 두번보고 자꾸만 보고싶네!! 진짜 대작 걸작!!!
10,진짜 마지막에 교훈 나온거 너무 슬프고 진짜 다들 연기도 잘하시고 진짜 눈물흘림ㅠㅠ
6,아맥으로 봐서 그나마 좀 나았네요. 영상은 좋지만 스토리도 액션도 평범..기대했던것 만큼은 아닌듯합니다.
10,아니 그냥 한마디면 됨 당신을 봅니다....
10,대박이에요…너무 재밋게봣어요
10,무조건 돌비에서 봐야됨 용아맥 ㄴㄴ
10,감독의 상상력과 높은 영상미가 좋아요
10,지루할 틈이 없었음. CG기술 또한 대박임.
10,Good!it is wonderful
8,"한국 영화관은 이제 돈 받고 장사할 수 없는 상태에 이르렀다.2K상영인데 3D안경쓰니까 해상도 더 떨어지고 명암비는 폭망 수준.돌비비전, HDR에 적응했는데 예전에 CD한장 짜리 영화보는 화질임.사운드도 돌비애트모스라고 하는데 전혀 아니었음.영화관 전부 망하는 게 당연하다고 생각함."
6,스토리 루즈하고 cg는 좋긴한데 호들갑 떨 정도는 아님. 2022년이 아닌 20OOO도에 나왔으면 정말 좋았을 영화.
8,영상과 사운드가 너무 아름다웠어요.
10,안보면 후회함 최고임
8,영상미도 멋있고 가족에 소중함을 다시한번 생각하는 영화입니다
8,약한 스토리 텔링을 상쇄하고도 남는 놀라운 시각적 향연. 극장에서 3D로 봐야 제 맛. 3시간이 그닥 지루하지 않음.
2,"진짜 기대 1도 안했는데, 기대 했으면 보다 나왔을 듯기대를 안했는데도 실망이니…스토리도 없고, 영상미라고는 물에서 노는 장면이라 그런지 보는 내내 푸른색만 돌아서 눈 아프고 어지럽고아 돈 아까워…"
10,제임스 카메룬 감독영화중에 실망한게 있음?ㅋㅋ 그걸로 끝이지
10,너무나 완벽한 영화였다.실제 판도라 행성에서 나비족을 섭외해서 찍었다는 농담이 믿기는 완벽한 CG에 배우들의 탄탄한 연기력 그리고 눈을 호강시키는 영상미까지 골고루 완벽한 최고의 영화.
10,아바타3가 기대된다…
